{
  "id": "level_0002",
  "title": "Mixed Tactics",
  "description": "Review fundamentals and learn new tactical patterns",
  "lesson": {
    "video": {
      "id": "lesson_0002",
      "title": "Introduction to Pins and Skewers",
      "url": "assets/videos/sample.mp4",
      "thumbnail": null
    }
  },
  "puzzles": [
    "puzzle_set_0002"
  ],
  "play": {
    "botIds": ["bot_0002"],
    "gamesRequired": 1
  },
  "boss": {
    "id": "boss_0002",
    "name": "Pin Master Paul",
    "elo": 700,
    "style": "positional"
  }
}